{
  "copies": [
    {
      "bytes_total": 1121753172,
      "count": 5531,
      "name": "left_output"
    },
    {
      "bytes_total": 1065414406,
      "count": 5531,
      "name": "right_output"
    }
  ],
  "environment": {
    "evidence_kind": "fixture",
    "kernel": "6.8.0-94-generic",
    "machine": "x86_64",
    "python": "3.11.14",
    "target": {
      "board": "not_applicable",
      "camera": "fixture",
      "supported": false
    }
  },
  "format": "ylx.performance-report.v0",
  "identity": {
    "commit": "132783d2885c7468d42186c6131cbe53f9198bb7",
    "software_version": "0.1.0",
    "wheel_sha256": "0b57872d2cf8fd69e8bbece33367e85094aa14219c3012dedd58bb478f2b7ffe"
  },
  "loss": {
    "application_drop": 0,
    "source_gap": 0,
    "unknown_gap": 0
  },
  "native": {
    "abi": null,
    "adapter": "python",
    "module_available": false,
    "module_version": null
  },
  "observed_at": "2026-09-04T22:48:04.583084Z",
  "queue": {
    "capacity": 1,
    "peak_depth": 0,
    "rejected": 0
  },
  "resources": {
    "bytes_written": 0,
    "cpu_time_ns": 1500202762,
    "rss_peak_bytes": 39538688
  },
  "result": {
    "effective_fps": 3686.6924854097747
  },
  "stages": [
    {
      "name": "jpeg_split",
      "p50_ns": 262144,
      "p95_ns": 262144,
      "samples": 5531,
      "total_ns": 1494493143
    }
  ],
  "workload": {
    "duration_ns": 1500260741,
    "frames_input": 5531,
    "frames_output": 5531,
    "kind": "fixed_trace",
    "mode": {
      "encoding": "mjpg",
      "fps": 60,
      "height": 1080,
      "width": 3840
    },
    "round": 3
  }
}
